ID,Title,Authors,PaperURL,ArtifactURL,ACMPaper,AuthorURLs,BestPaperFinalist,SessionID,SessionOrder,Presenter
525,Distributed Measurement with Private Set-Union Cardinality,Ellis Fenske (Tulane University); Akshaya Mani (Georgetown University); Aaron Johnson (U.S. Naval Research Lab); Micah Sherr (Georgetown University),,,p2277-agrawalAT3.pdf,"http://cs.tulane.edu/~efenske,https://www.linkedin.com/in/akshayamani/,http://ohmygodel.com/,https://security.cs.georgetown.edu/~msherr/",,K1,1,Akshaya Mani
555,Efficient Public Trace-and-Revoke from Standard Assumptions,"Shweta Agrawal (IIT Madras); Sanjay Bhattacherjee (Turing Lab, ASU, ISI Kolkata); Duong Hieu Phan (XLIM [U. Limoges, CNRS], France); Damien Stehle (ENS Lyon, Laboratoire LIP [U. Lyon, CNRS, ENSL, INRIA, UCBL]); Shota Yamada (National Institute of Advanced Industrial Science and Technology [AIST], Japan)",https://eprint.iacr.org/2017/650,,p2295-fenskeA.pdf,"http://www.cse.iitm.ac.in/~shwetaag/, https://sites.google.com/site/sanjaybhattacherjee/, http://www.di.ens.fr/users/phan/, http://perso.ens-lyon.fr/damien.stehle/, https://staff.aist.go.jp/yamada-shota/",,K1,1,Duong Hieu Phan
565,Designing New Operating Primitives to Improve Fuzzing Performance,"Wen Xu, Sanidhya Kashyap, Changwoo Min, and Taesoo Kim (Georgia Institute of Technology)",,,p2313-xuA.pdf,gts3.org,,K2,1,Wen Xu
445,Directed Greybox Fuzzing,"Marcel B&ouml;hme, Van-Thuan Pham, Manh-Dung Nguyen, and Abhik Roychoudhury (National University of Singapore)",https://www.comp.nus.edu.sg/~mboehme/paper/CCS17.pdf,https://github.com/aflgo/aflgo,p2329-bohmeAemb.pdf,"https://www.comp.nus.edu.sg/~mboehme, https://www.comp.nus.edu.sg/~thuanpv, https://strongcourage.github.io/, https://www.comp.nus.edu.sg/~abhik",,K2,2,Marcel B_hme
847,IMF: Inferred Model-based Fuzzer,HyungSeok Han and Sang Kil Cha (KAIST),,https://github.com/SoftSec-KAIST/IMF,p2345-hanA.pdf,"http://daramg.gift/ , https://softsec.kaist.ac.kr/~sangkilc/",,K2,3,HyungSeok Han
626,PtrSplit: Supporting general pointers in automatic program partitioning,"Shen Liu, Gang Tan, and Trent Jaeger (The Pennsylvania State University)",,,p2359-liuAemb.pdf,,,K3,1,Shen Liu
612,HexType: Efficient Detection of Type Confusion Errors for C++,"Yuseok Jeon (Purdue University); Priyam Biswas, Scott Carr, Byoungyoung Lee, and Mathias Payer (Purdue University)",,,p2373-jeonA.pdf,,,K3,2,Yuseok Jeon
2,FreeGuard: A Faster Secure Heap Allocator,"Sam Silvestro, Hongyu Liu, and Corey Crosser (University of Texas at San Antonio); Zhiqiang Lin (University of Texas at Dallas); Tongping Liu (University of Texas at San Antonio)",,https://github.com/UTSASRG/FreeGuard,p2389-silvestroA.pdf,,,K3,3,Sam Silvestro
532,JITGuard: Hardening Just-in-time Compilers with SGX,"Tommaso Frassetto, David Gens, Christopher Liebchen, and Ahmad-Reza Sadeghi (Technische Universit&auml;t Darmstadt)",https://www.informatik.tu-darmstadt.de/fileadmin/user_upload/Group_TRUST/PubsPDF/JITGuard-authorversion.pdf,,p2405-frassettoA.pdf,"https://www.trust.informatik.tu-darmstadt.de/people/tommaso-frassetto/,https://www.trust.informatik.tu-darmstadt.de/people/david-gens/,https://www.trust.informatik.tu-darmstadt.de/people/christopher-liebchen/,https://www.trust.informatik.tu-darmstadt.de/people/ahmad-reza-sadeghi/",,K4,1,Tommaso Frassetto
540,Leaky Cauldron on the Dark Land: Understanding Memory Side-Channel Hazards in SGX,Wenhao Wang (Indiana University); Guoxing Chen (The Ohio State University); Xiaorui Pan (Indiana University); Yinqian Zhang (The Ohio State University); XiaoFeng Wang (Indiana University); Vincent Bindschaedler (University of Illinois at Urbana-Champaign); Haixu Tang (Indiana University); Carl A. Gunter (University of Illinois at Urbana-Champaign),,,p2421-wangA.pdf,,,K4,2,Wenhao Wang
813,A Formal Foundation for Secure Remote Execution of Enclaves,"Pramod Subramanyan and Rohit Sinha (University of California, Berkeley); Ilia Lebedev and Srinivas Devadas (Massachusetts Institute of Technology); Sanjit Seshia (University of California, Berkeley)",https://eprint.iacr.org/2017/565,https://github.com/0tcb/TAP,p2435-subramanyanA.pdf,"http://www.spramod.info, https://people.eecs.berkeley.edu/~rsinha/, http://ilia.hackartscience.com/, https://people.csail.mit.edu/devadas/, https://people.eecs.berkeley.edu/~sseshia/",1,K4,3,Pramod Subramanyan