ID,Title,Authors,PaperURL,ArtifactURL,ACMPaper,AuthorURLs,BestPaperFinalist,SessionID,SessionOrder,Presenter
598,POISED: Spotting Twitter Spam Off the Beaten Paths,"Shirin Nilizadeh (University of California, Santa Barbara); Fran&ccedil;ois Labr&egrave;che (&Eacute;cole Polytechnique de Montr&eacute;al); Alireza Sadighian (&Eacute;cole Polytechnique de Montr&eacute;al); Ali Zand (University of California, Santa Barbara); Jos&eacute;&nbsp;Fernandez (&Eacute;cole Polytechnique de Montr&eacute;al); Christopher Kruegel (University of California, Santa Barbara); Gianluca Stringhini (University College London); Giovanni Vigna (University of California, Santa Barbara) ",https://arxiv.org/abs/1708.09058,,p1159-nilizadehAemb.pdf,"http://nilizadeh.github.io/, http://francoislabreche.com/,  , http://cs.ucsb.edu/~zand/, http://www.polymtl.ca/recherche/rc/en/professeurs/details.php?NoProf=299, http://www.cs.ucsb.edu/~chris/, http://www0.cs.ucl.ac.uk/staff/G.Stringhini/, http://www.cs.ucsb.edu/~vigna/,",,E4,3,Shirin Nilizadeh
188,Practical Secure Aggregation for Privacy-Preserving Machine Learning,"Keith Bonawitz, Vladimir Ivanov, and Ben Kreuter (Google); Antonio Marcedone (Cornell University); H. Brendan McMahan, Sarvar Patel, Daniel Ramage, Aaron Segal, and Karn Seth (Google)",https://eprint.iacr.org/2017/281.pdf,,p1175-bonawitzA.pdf,,,E5,1,Aaron Segal
807,Use Privacy in Data-Driven Systems: Theory and Experiments with Machine Learnt Programs,"Anupam Datta, Matthew Fredrikson, Gihyuk Ko, Piotr Mardziel, and Shayak Sen (Carnegie Mellon University)",https://arxiv.org/abs/1705.07807,https://github.com/cmu-transparency/artifact-proxyuse-ccs2017,p1193-dattaA.pdf,"http://www.andrew.cmu.edu/user/danupam/,http://www.cs.cmu.edu/~mfredrik/,https://www.linkedin.com/in/gihyukko/,http://piotr.mardziel.com/,http://www.cs.cmu.edu/afs/cs.cmu.edu/Web/People/shayaks/",,E5,2,Piotr Mardziel
784,SGX-BigMatrix: A Practical Encrypted Data Analytic Framework With Trusted Processors,"Fahad Shaon, Murat Kantarcioglu, Zhiqiang Lin, and Latifur Khan (University of Texas at Dallas)",,,p1211-shaonA.pdf,"https://www.shaon.org, http://www.utdallas.edu/~muratk/,https://www.utdallas.edu/~zxl111930/,https://www.utdallas.edu/~lkhan/",,E5,3,Fahad Shaon
563,Malicious-Secure Private Set Intersection via Dual Execution,Peter Rindal and Mike Rosulek (Oregon State University),https://eprint.iacr.org/2017/769,https://github.com/osu-crypto/libPSI,p1229-rindalA.pdf,,,F1,1,Peter Rindal
610,Fast Private Set Intersection from Homomorphic Encryption,Hao Chen and Kim Laine (Microsoft Research); Peter Rindal (Oregon State University),https://eprint.iacr.org/2017/299,,p1243-chenA.pdf,,,F1,2,Hao Chen
621,Practical Multi-party Private Set Intersection from Symmetric-Key Techniques,Vladimir Kolesnikov (Bell Labs); Naor Matania and Benny Pinkas (Bar-Ilan University); Mike Rosulek and Ni Trieu (Oregon State University),https://eprint.iacr.org/2017/799,https://github.com/osu-crypto/MultipartyPSI,p1257-kolesnikovA.pdf,"http://ect.bell-labs.com/who/kolesnikov/, ,www.pinkas.net, web.engr.oregonstate.edu/~rosulekm/, http://people.oregonstate.edu/~trieun/",,F1,3,Ni Trieu
304,Detecting Structurally Anomalous Logins Within Enterprise Networks,Hossein Siadati and Nasir Memon (New York University),,,p1273-siadatiA.pdf,"http://engineering.nyu.edu/people/hossein-siadati, http://engineering.nyu.edu/people/nasir-memon",,F2,1,Hossein Siadati
381,DeepLog: Anomaly Detection and Diagnosis from System Logs through Deep Learning,"Min Du, Feifei Li, Guineng Zheng, and Vivek Srikumar (University of Utah)",,,p1285-duA.pdf,,,F2,2,Min Du
454,Predicting the Risk of Cyber Incidents,"Leyla Bilge, Yufei Han, and Matteo Dell'Amico (Symantec Research Labs)",,,p1299-bilgeA.pdf,,,F2,3,Leyla Bilge
470,Key Reinstallation Attacks: Forcing Nonce Reuse in WPA2,"Mathy Vanhoef and Frank Piessens (KU Leuven, imec-DistriNet)",https://papers.mathyvanhoef.com/ccs2017.pdf,,p1313-vanhoefA.pdf,,1,F3,1,Mathy Vanhoef
362,"CCCP: Closed Caption Crypto Phones to Resist MITM Attacks, Human Errors and Click-Through",Maliheh Shirvanian and Nitesh Saxena (University of Alabama at Birmingham),,,p1329-shirvanianA.pdf,http://spies.cs.uab.edu/,,F3,2,Maliheh Shirvanian
319,No-Match Attacks and Robust Partnering Definitions &mdash; Defining Trivial Attacks for Security Protocols is Not Trivial,Yong Li (Huawei Technologies D&uuml;sseldorf); Sven Sch&auml;ge (Ruhr-Universit&auml;t Bochum),https://eprint.iacr.org/2017/818,,p1343-liA.pdf,http://www.cits.rub.de/personen/schaege,,F3,3,Sven Sch_ge
339,Querying for Queries: Indexes of Queries for Efficient and Expressive IT-PIR,Syed Mahbub Hafiz and Ryan Henry (Indiana University),https://eprint.iacr.org/2017/825,,p1361-hafizA.pdf,",http://homes.soic.indiana.edu/henry/",,F4,1,Syed Mahbub Hafiz
837,PeGaSus: Data-Adaptive Differentially Private Stream Processing,Yan Chen and Ashwin Machanavajjhala (Duke University); Michael Hay (Colgate University); Gerome Miklau (University of Massachusetts Amherst),,,p1375-chenA.pdf,,,F4,2,Yan Chen
485,Composing Differential Privacy and Secure Computation: A case study on scaling private record linkage,Xi He and Ashwin Machanavajjhala (Duke University); Cheryl Flynn and Divesh Srivastava (AT&T Labs-Research),https://arxiv.org/abs/1702.00535,,p1389-heA.pdf,,,F4,3,Xi He
325,Where the Wild Warnings Are: Root Causes of Chrome HTTPS Certificate Errors,"Mustafa Emre Acer, Emily Stark, and Adrienne Porter Felt (Google); Sascha Fahl (Leibniz University Hannover); Radhika Bhargava (Purdue University); Bhanu Dev (International Institute of Information Technology Hyderabad); Matt Braithwaite, Ryan Sleevi, and Parisa Tabriz (Google)",,,p1407-acerA.pdf,,,F5,1,Emily Stark
640,"Data breaches, phishing, or malware? Understanding the risks of stolen credentials","Kurt Thomas (Google); Frank Li (University of California, Berkeley); Ali Zand, Jake Barrett, Juri Ranieri, Luca Invernizzi, Yarik Markov, Oxana Comanescu, Vijay Eranti, Angelika Moscicki, and Dan Margolis (Google); Vern Paxson (University of California, Berkeley); Elie Bursztein (Google)",,,p1421-thomasAembCC.pdf,,,F5,2,Kurt Thomas
11,Certified Malware: Measuring Breaches of Trust in the Windows Code-Signing PKI,"Doowon Kim, Bum Jun Kwon, and Tudor Dumitra&#351;&nbsp;(University of Maryland)",,,p1435-kimA.pdf,,,F5,3,Doowon Kim
131,Forward Secure Dynamic Searchable Symmetric Encryption with Efficient Updates,"Kee Sung Kim, Minkyu Kim, Dongsoo Lee, Je Hong Park, and Woo-Hwan Kim (National Security Research Institute)",,,p1449-kimA.pdf,,,G1,1,Kee Sung Kim
183,Forward and Backward Private Searchable Encryption from Constrained Cryptographic Primitives,"Raphael Bost ([Direction G&eacute;n&eacute;rale de l'Armement - Maitrise de l'Information/Universit&eacute;&nbsp;de Rennes 1]); Brice Minaud (Royal Holloway, University of London); Olga Ohrimenko (Microsoft Research, Cambridge)",https://eprint.iacr.org/2017/805,https://github.com/OpenSSE/opensse-schemes,p1465-bostA.pdf,"https://raphael.bost.fyi, https://pure.royalholloway.ac.uk/portal/en/persons/brice-minaud(5c667ab8-fbf7-4adc-8c76-5c1cbd260087).html, https://www.microsoft.com/en-us/research/people/oohrim/",,G1,2,Raphael Bost
33,Economic Factors of Vulnerability Trade and Exploitation: Empirical evidence from a prominent Russian cybercrime market,Luca Allodi (Eindhoven University of Technology),https://arxiv.org/abs/1708.04866,,p1483-allodiA.pdf,,,G2,1,Luca Allodi
570,Quantifying the Pressure of Legal Risks on Third-party Vulnerability Research,"Alexander Gamero-Garrido, Stefan Savage, Kirill Levchenko, and Alex C. Snoeren (University of California, San Diego)",https://papers.ssrn.com/sol3/papers.cfm?abstract_id=3029140,https://drive.google.com/file/d/0ByquBcDFaNXhRElvRl9md0QyR1k/view?usp=sharing,p1501-gamero-garridoA.pdf,"http://cseweb.ucsd.edu/~agamerog,http://cseweb.ucsd.edu/~savage,http://cseweb.ucsd.edu/~klevchen,http://cseweb.ucsd.edu/~snoeren",,G2,2,Alexander Gamero-Garrido
247,Identity-Based Format-Preserving Encryption,"Mihir Bellare (University of California, San Diego); Viet Tung Hoang (Florida State University)",,,p1515-bellareA.pdf,,,G3,1,Viet Tung Hoang
548,Standardizing Bad Cryptographic Practice - A teardown of the IEEE standard for protecting electronic-design intellectual property,"Animesh Chhotaray, Adib Nahiyan, Thomas Shrimpton, Domenic J Forte, and Mark Tehranipoor (University of Florida)",,,p1533-chhotarayA.pdf,"N/A , N/A , www.cise.ufl.edu/~teshrim , http://dforte.ece.ufl.edu/ , N/A ",,G3,2,Animesh Chhotaray
642,New Techniques for Structural Batch Verification in Bilinear Groups with Applications to Groth-Sahai Proofs,Gottfried Herold (ENS Lyon); Max Hoffmann (Ruhr-Universit&auml;t Bochum); Michael Kloo&#xdf;&nbsp;(Karlsruhe Institute of Technology); Carla R&agrave;fols (UPF Barcelona); Andy Rupp (Karlsruhe Institute of Technology),https://eprint.iacr.org/2017/802,,p1547-heroldA.pdf,,,G4,1,Michael Kloo_
823,Practical Quantum-Safe Voting from Lattices,"Rafael del Pino, Vadim Lyubashevsky, Gregory Neven, and Gregor Seiler (IBM Research - Z&uuml;rich)",,,p1565-del-pinoA.pdf,,,G4,2,Rafael del Pino
48,A Touch of Evil: High-Assurance Cryptographic Hardware from Untrusted Components,Vasilios Mavroudis and Andrea Cerulli (University College London); Petr Svenda (Masaryk University); Dan Cvrcek and Dusan Klinec (EnigmaBridge); George Danezis (University College London),https://arxiv.org/abs/1709.03817,http://trojantolerance.org,p1583-mavroudisA.pdf,"https://mavroud.is,,,,,,",,G5,1,Vasilios Mavroudis
194,Provably-Secure Logic Locking: From Theory To Practice,"Muhammad Yasin, Abhrajit Sengupta, Mohammed Thari Nabeel, Mohammed Ashraf (New York University); Jeyavijayan [JV] Rajendran (University of Texas at Dallas); Ozgur Sinanoglu (New York University)",,,p1601-yasinA.pdf,"https://wp.nyu.edu/yasin/, https://wp.nyu.edu/as9397/, , , , http://sites.nyuad.nyu.edu/dfx/",,G5,2,Muhammad Yasin
124,The Return of Coppersmith's Attack: Practical Factorization of Widely Used RSA Moduli,Matus Nemec ([Masaryk University/Ca' Foscari University of Venice]); Marek Sys and Petr Svenda (Masaryk University); Dusan Klinec ([Masaryk University/EnigmaBridge]); Vashek Matyas (Masaryk University),,https://crocs.fi.muni.cz/papers/rsa_ccs17,p1631-nemecA.pdf,,1,H1,1,Matus Nemec
186,Algorithm Substitution Attacks from a Steganographic Perspective,Sebastian Berndt and Maciej Liskiewicz (University of Luebeck),https://arxiv.org/abs/1708.06199,,p1649-berndtA.pdf,"http://seberndt.github.io/, http://www.tcs.uni-luebeck.de/de/mitarbeiter/liskiewi/",,H1,2,Maciej Liskiewicz
542,On the Power of Optical Contactless Probing: Attacking Bitstream Encryption of FPGAs,"Shahin Tajik, Heiko Lohrke, Jean-Pierre Seifert, and Christian Boit (Technische Universit&auml;t Berlin)",https://eprint.iacr.org/2017/822,,p1661-tajikA.pdf,,1,H1,3,Shahin Tajik and Heiko Lohrke
467,The Dynamics of Innocent Flesh on the Bone: Code Reuse Ten Years Later,"Victor van&nbsp;der&nbsp;Veen, Dennis Andriesse, Manolis Stamatogiannakis (Vrije Universiteit Amsterdam); Xi Chen ([Vrije Universiteit Amsterdam/Microsoft]); Herbert Bos, and Cristiano Giuffrida (Vrije Universiteit Amsterdam)",https://vvdveen.com/publications/newton.pdf,https://vusec.net/projects/newton,p1675-van-der-veenA.pdf,"https://vvdveen.com, https://syssec.mistakenot.net, https://vusec.net/manolis, <NO PAGE FOR CHEN>, https://vusec.net/herbert, https://vusec.net/cristiano",,H2,1,Victor van der veen
816,Capturing Malware Propagations with Code Injections and Code-Reuse attacks,"David Korczynski (University of Oxford); Heng Yin (University of California, Riverside)",,,p1691-korczynskiA.pdf,,,H2,2,david korczynski
765,Code-reuse attacks for the Web: Breaking Cross-Site Scripting Mitigations via Script Gadgets,Sebastian Lekies and Krzysztof Kotowicz (Google); Samuel Gro&#xdf;&nbsp;(SAP SE); Eduardo Vela (Google); Martin Johns (SAP SE),,,p1709-lekiesA.pdf,,,H2,3,Sebastian Lekies
123,Tail Attacks on Web Applications,"Huasong Shan and Qingyang Wang (Louisiana State University, Computer Science and Engineering Division); Calton Pu (Georgia Institute of Technology)",,,p1725-shanAemb.pdf,,,H3,1,Qingyang Wang
557,Rewriting History: Changing the Archived Web from the Present,"Ada Lerner (Wellesley College); Tadayoshi Kohno, and Franziska Roesner (University of Washington)",http://repository.wellesley.edu/cgi/viewcontent.cgi?article=1158&context=scholarship,https://rewritinghistory.cs.washington.edu,p1741-lernerAT3.pdf,"https://adalerner.com/, https://homes.cs.washington.edu/~yoshi/, https://www.franziroesner.com/",,H3,2,Ada Lerner
29,Deemon: Detecting CSRF with Dynamic Analysis and Property Graphs,"Giancarlo Pellegrino (CISPA, Saarland University); Martin Johns (SAP SE); Simon Koch, Michael Backes, and Christian Rossow (CISPA, Saarland University)",https://arxiv.org/pdf/1708.08786.pdf,,p1757-pellegrinoA.pdf,,,H3,3,Giancarlo Pellegrino
615,A Comprehensive Symbolic Analysis of TLS 1.3,"Cas Cremers (University of Oxford); Marko Horvat (The Max Planck Institute For Software Systems); Jonathan Hoyland, Sam Scott, and Thyla van&nbsp;der&nbsp;Merwe (Royal Holloway, University of London)",http://tls13tamarin.github.io/TLS13Tamarin/,http://tls13tamarin.github.io/TLS13Tamarin/,p1773-cremersA.pdf,,,H4,1,Jonathan Hoyland
558,HACL&#42;: A Verified Modern Cryptographic Library,Jean-Karim Zinzindohou&eacute;(Inria Paris); Karthikeyan Bhargavan (Inria Paris); Jonathan Protzenko (Microsoft Research); Benjamin Beurdouche (Inria Paris),https://eprint.iacr.org/2017/536,https://github.com/mitls/hacl-star,p1789-zinzindohoueA.pdf,"http://prosecco.inria.fr, https://project-everest.github.io",,H4,2,Jean Karim Zinzindohou_
676,Jasmin: High-Assurance and High-Speed Cryptography,Jos&eacute;&nbsp;Bacelar Almeida ([HASLab -- INESC TEC/Universidade do Minho]); Manuel Barbosa ([HASLab -- INESC TEC/DCC FC Universidade do Porto]); Gilles Barthe (IMDEA Software Institute); Arthur Blot (ENS Lyon); Benjamin Gr&eacute;goire (Inria); Vincent Laporte (IMDEA Software Institute); Tiago Oliveira and Hugo Pacheco ([HASLab -- INESC TEC/Universidade do Minho]); Benedikt Schmidt (IMDEA Software Institute); Pierre-Yves Strub (Ecole Polytechnique),,https://github.com/jasmin-lang/jasmin,p1807-almeidaA.pdf,,,H4,3,Vincent Laporte
252,Post-Quantum Zero-Knowledge and Signatures from Symmetric-Key Primitives,Melissa Chase (Microsoft Research); David Derler (Graz University of Technology); Steven Goldfeder (Princeton University); Claudio Orlandi (Aarhus University); Sebastian Ramacher (Graz University of Technology); Christian Rechberger ([Graz University of Technology/Denmark Technical University]); Daniel Slamanig (AIT Austrian Institute of Technology); Greg Zaverucha (Microsoft Research),,,p1825-chaseA.pdf,,,I1,1,Steven Goldfeder and Sebastian Ramacher
456,To BLISS-B or not to be - Attacking strongSwan's Implementation of Post-Quantum Signatures,Peter Pessl (Graz University of Technology); Leon Groot Bruinderink (Technische Universiteit Eindhoven); Yuval Yarom ([University of Adelaide/Data61]),https://eprint.iacr.org/2017/490,,p1843-pesslA.pdf,,,I1,2,Peter Pessl
472,Side-Channel Attacks on BLISS Lattice-Based Signatures: Exploiting Branch Tracing Against strongSwan and Electromagnetic Emanations in Microcontrollers,Thomas Espitau (UPMC); Pierre-Alain Fouque (Universit&eacute;&nbsp;de Rennes 1); Beno&iuml;t G&eacute;rard (DGA.MI); Mehdi Tibouchi (NTT Secure Platform Laboratories),https://eprint.iacr.org/2017/505,https://github.com/mti/bliss-sidechannel,p1857-espitauA.pdf,"https://almasty.lip6.fr/~espitau/, https://www.di.ens.fr/~fouque/, http://people.irisa.fr/Benoit.Gerard/, https://www.normalesup.org/~tibouchi/",,I1,3,Mehdi Tibouchi
597,Nonmalleable Information Flow Control,"Ethan Cecchetti and Andrew Myers (Cornell University); Owen Arden (University of California, Santa Cruz)",https://www.cs.cornell.edu/~ethan/papers/nmifc.pdf,,p1875-cecchettiA.pdf,"https://www.cs.cornell.edu/~ethan/,https://www.cs.cornell.edu/andru/,https://users.soe.ucsc.edu/~owen/",1,I2,1,Ethan Cecchetti
527,Cryptographically Secure Information Flow Control on Key-Value Stores,"Lucas Waye, Pablo Buiras (Harvard University); Owen Arden (University of California, Santa Cruz); Alejandro Russo (Chalmers University of Technology); Stephen Chong (Harvard University)",https://arxiv.org/abs/1708.08895,,p1893-wayeACC.pdf,"http://lucaswaye.com/,http://people.seas.harvard.edu/~pbuiras/,https://users.soe.ucsc.edu/~owen/,http://www.cse.chalmers.se/~russo/,http://people.seas.harvard.edu/~chong/",,I2,2,Lucas Waye
195,Object Flow Integrity,"Wenhao Wang, Xiaoyang Xu, and Kevin Hamlen (University of Texas at Dallas)",,,p1909-wangA.pdf,"http://www.utdallas.edu/~wenhao.wang, ,http://www.utdallas.edu/~hamlen",,I2,3,Wenhao Wang
649,BBA+: Improving the Security and Applicability of Privacy-Preserving Point Collection,Gunnar Hartung (Karlsruhe Institute of Technology); Max Hoffmann (Ruhr-Universit&auml;t Bochum); Matthias Nagel and Andy Rupp (Karlsruhe Institute of Technology),,,p1925-hartungA.pdf,"https://crypto.iti.kit.edu/?id=hartung, https://www.emsec.rub.de/chair/_staff/Max_Hoffmann/, https://crypto.iti.kit.edu/?id=nagel, https://homepage.ruhr-uni-bochum.de/andy.rupp/",,I3,1,Matthias Nagel
145,walk2friends: Inferring Social Links from Mobility Profiles,"Michael Backes (CISPA, Saarland University); Mathias Humbert (Swiss Data Science Center, ETH/EPFL); Jun Pang (University of Luxembourg); Yang Zhang (CISPA, Saarland University)",https://arxiv.org/abs/1708.08221,https://github.com/yangzhangalmo/walk2friends,p1943-backesA.pdf,"https://infsec.cs.uni-saarland.de/~backes/,http://www.mhumbert.com/,http://satoss.uni.lu/members/jun/,https://yangzhangalmo.github.io/",,I3,2,Yang Zhang
306,Back to the drawing board: Revisiting the design of optimal location privacy-preserving mechanisms,Simon Oya (University of Vigo); Carmela Troncoso (IMDEA Software Institute); Fernando P&eacute;rez-Gonz&aacute;lez (University of Vigo),https://arxiv.org/abs/1705.08779,,p1959-oyaA.pdf,"http://gpsc.uvigo.es/users/simon-oya-diez, https://software.imdea.org/~carmela.troncoso/, http://gpsc.uvigo.es/fernando-perez-gonzalez",,I3,3,Simon Oya
665,Certified Verification of Algebraic Properties on Low-Level Mathematical Constructs in Cryptographic Programs,"Ming-Hsien Tsai, Bow-Yaw Wang, and Bo-Yin Yang (Academia Sinica)",,,p1973-tsaiA.pdf,,,I4,1,Ming-Hsien Tsai
410,A Fast and Verified Software Stack for Secure Function Evaluation,Jos&eacute;&nbsp;Bacelar Almeida ([HASLab -- INESC TEC/Universidade do Minho]); Manuel Barbosa ([HASLab -- INESC TEC/DCC FC Universidade do Porto]); Gilles Barthe (IMDEA Software Institute); Fran&ccedil;ois Dupressoir (University of Surrey); Benjamin Gr&eacute;goire (INRIA Sophia-Antipolis); Vincent Laporte (IMDEA Software Institute); Vitor Pereira ([HASLab -- INESC TEC/DCC FC Universidade do Porto]),https://eprint.iacr.org/2017/821,http://bit.ly/2xJtHLW,p1989-almeidaA.pdf,"http://haslab.uminho.pt/jba/, http://haslab.uminho.pt/mbb/, https://software.imdea.org/people/gilles.barthe/, https://fdupress.net, http://www-sop.inria.fr/members/Benjamin.Gregoire/, http://software.imdea.org/people/vincent.laporte/, http://haslab.uminho.pt/vm2p/",,I4,2,Vitor Pereira
148,Verified Correctness and Security of mbedTLS HMAC-DRBG,Katherine Q. Ye ([Princeton University/Carnegie Mellon University]); Matthew Green (Johns Hopkins University); Naphat Sanguansin and Lennart Beringer (Princeton University); Adam Petcher (Oracle); Andrew W. Appel (Princeton University),https://arxiv.org/abs/1708.08542,http://github.com/PrincetonUniversity/VST/tree/master/hmacdrbg,p2007-yeA.pdf,"https://www.cs.cmu.edu/~kqy/, https://isi.jhu.edu/~mgreen/, https://www.linkedin.com/in/naphat-sanguansin-495aa55b, http://www.cs.princeton.edu/~eberinge/, http://adam.petcher.net/, https://www.cs.princeton.edu/~appel/",,I4,3,Katherine Ye
318,How Unique is Your .onion? An Analysis of the Fingerprintability of Tor Onion Services,Rebekah Overdorf (Drexel University); Marc Juarez and Gunes Acar (KU Leuven); Rachel Greenstadt (Drexel University); Claudia Diaz (KU Leuven),https://arxiv.org/abs/1708.08475,https://cosic.esat.kuleuven.be/fingerprintability/,p2021-overdorfA.pdf,,1,I5,1,Rebekah Overdorf
658,The Waterfall of Liberty: Decoy Routing Circumvention that Resists Routing Attacks,"Milad Nasr, Hadi Zolfaghari, and Amir Houmansadr (University of Massachusetts Amherst)",,https://github.com/SPIN-UMass/waterfall,p2037-nasrA.pdf,,,I5,2,Hadi Zolfaghari
654,Compressive Traffic Analysis: A New Paradigm for Scalable Traffic Analysis,"Milad Nasr, Amir Houmansadr, and Arya Mazumdar (University of Massachusetts Amherst)",http://people.cs.umass.edu/~milad/papers/compress_CCS.pdf,,p2053-nasrA.pdf,http://people.cs.umass.edu/~milad/,,I5,3,Milad Nasr
190,Full accounting for verifiable outsourcing,Riad S. Wahby (Stanford University); Ye Ji (New York University); Andrew J. Blumberg (University of Texas at Austin); abhi shelat (Northeastern University); Justin Thaler (Georgetown University); Michael Walfish and Thomas Wies (New York University),https://eprint.iacr.org/2017/242/,,p2071-wahbyA.pdf,,,J1,1,Riad S. Wahby
865,Ligero: Lightweight Sublinear Arguments Without a Trusted Setup,"Scott Ames (University of Rochester); Carmit Hazay (Bar-Ilan University); Yuval Ishai ([Technion/University of California, Los Angeles]); Muthuramakrishnan Venkitasubramaniam (University of Rochester)",,,p2087-amesA.pdf,"http://www.cs.rochester.edu/u/sames/,http://www.eng.biu.ac.il/hazay/,http://www.cs.technion.ac.il/~yuvali/,http://www.cs.rochester.edu/u/muthuv/",,J1,2,Muthuramakrishnan Venkitasubramaniam
885,Homomorphic Secret Sharing: Optimizations and Applications,"Elette Boyle (IDC Herzliya); Geoffroy Couteau (ENS, Paris); Niv Gilboa (Ben Gurion University); Yuval Ishai ([Technion/University of California, Los Angeles]); Michele Orru (ENS, Paris)",,https://www.di.ens.fr/~orru/hss/,p2105-boyleA.pdf,,,J1,3,Geoffroy Couteau
644,DIFUZE: Interface Aware Fuzzing for Kernel Drivers,"Jake Corina, Aravind Machiry, Christopher Salls (University of California, Santa Barbara); Yan Shoshitaishvili (Arizona State University); Shuang Hao (University of Texas at Dallas); Christopher Kruegel, and Giovanni Vigna (University of California, Santa Barbara)",,https://github.com/ucsb-seclab/difuze,p2123-corinaA.pdf,https://machiry.github.io/,,J2,1,Aravind Machiry
727,SemFuzz: Semantics-based Automatic Generation of Proof-of-Concept&nbsp;Exploits,"Wei You (Indiana University); Peiyuan Zong and Kai Chen (Chinese Academy of Sciences, Institute of Information Engineering); XiaoFeng Wang (Indiana University); Xiaojing Liao (William and Mary); Pan Bian and Bin Liang (Renmin University of China)",,,p2139-youA.pdf,,,J2,2,Wei You
651,SlowFuzz: Automated Domain-Independent Detection of Algorithmic Complexity Vulnerabilities,"Theofilos Petsios, Jason Zhao, Angelos D. Keromytis, and Suman Jana (Columbia University)",https://arxiv.org/abs/1708.08437,,p2155-petsiosA.pdf,"http://www.cs.columbia.edu/~theofilos/,,http://sumanj.info/,http://www.cs.columbia.edu/~angelos/",,J2,3,Theofilos Petsios
573,Checking Open-Source License Violation and 1-day Security Risk at Large Scale,"Ruian Duan, Ashish Bijlani, Meng Xu, Taesoo Kim, and Wenke Lee (Georgia Institute of Technology)",,,p2169-duanA.pdf,,,J3,1,Ruian Duan
603,Keep me Updated: An Empirical Study of Third-Party Library Updatability on Android,"Erik Derr, Sven Bugiel (CISPA, Saarland University); Sascha Fahl (Leibniz University Hannover); Yasemin Acar (Leibniz University Hannover); Michael Backes (CISPA, Saarland University)",https://www.infsec.cs.uni-saarland.de/~derr/publications/pdfs/derr_ccs17.pdf,https://github.com/reddr/LibScout,p2187-derrA.pdf,,,J3,2,Erik Derr
650,A Large-Scale Empirical Study of Security Patches,"Frank Li and Vern Paxson (University of California, Berkeley)",,,p2201-liA.pdf,,,J3,3,Frank Li
354,DEFTL: Implementing Plausibly Deniable Encryption in Flash Translation Layer,"Shijie Jia and Luning Xia (Chinese Academy of Sciences, Institute of Information Engineering); Bo Chen (Michigan Technological University); Peng Liu (The Pennsylvania State University, College of Information Sciences and Technology)",,,p2217-jiaA.pdf,"Shijie Jia (http://www.escience.cn/people/IIEjiashijie/index.html), Bo Chen(http://www.chenirvine.org/), Peng Liu(https://s2.ist.psu.edu/pliu/)",,J4,1,Shijie Jia
526,FlashGuard: Leveraging Intrinsic Flash Properties to Defend Against Encryption Ransomware,"Jian Huang (Georgia Institute of Technology); Jun Xu,Xinyu Xing, and Peng Liu (The Pennsylvania State University); Moinuddin K. Qureshi (Georgia Institute of Technology)",,,p2231-huangA.pdf,"https://www.cc.gatech.edu/~jhuang95/, http://www.personal.psu.edu/users/j/x/jxx13/, http://xinyuxing.org/, https://s2.ist.psu.edu/pliu/, http://moin.ece.gatech.edu/",,J4,2,Jian Huang
577,FirmUSB: Vetting USB Device Firmware using Domain Informed Symbolic Execution,"Grant Hernandez, Farhaan Fowze, Dave [Jing] Tian, Tuba Yavuz, and Kevin Butler (University of Florida)",https://arxiv.org/abs/1708.09114,,p2245-hernandezA.pdf,"https://granthernandez.com , https://sites.google.com/site/farhaanfowze/ , davejingtian.org , http://www.tuba.ece.ufl.edu/ , www.kevinbutler.org",,J4,3,Grant Hernandez
458,TinyOLE: Efficient Actively Secure Two-Party Computation from Oblivious Linear Function Evaluation,"Nico D&ouml;ttling (University of California, Berkeley); Satrajit Ghosh, Jesper Buus Nielsen, Tobias Nilges, and Roberto Trifiletti (Aarhus University)",,,p2263-dottlingA.pdf,,,K1,1,Satrajit Ghosh
